{
  "$schema": "../../../contracts/capability.schema.json",
  "schemaVersion": "0.1.0",
  "id": "write-user-stories",
  "version": "0.1.0",
  "title": "Write User Stories",
  "summary": "Turn product outcomes and source evidence into traceable, vertically sliced, refinement-ready user stories.",
  "owner": {
    "name": "ohmywork maintainers",
    "contact": "https://github.com/lamhoangcatvy/ohmywork/issues"
  },
  "maturity": "experimental",
  "roles": ["product-owner"],
  "lifecycleStages": ["requirements"],
  "contract": {
    "inputs": [
      {
        "name": "product-context",
        "mediaType": "text/plain",
        "required": true
      },
      {
        "name": "source-artifacts",
        "mediaType": "application/octet-stream",
        "required": false
      }
    ],
    "outputs": [
      {
        "name": "user-story-set",
        "mediaType": "text/markdown",
        "required": true,
        "template": "assets/user-stories-template.md"
      }
    ],
    "errors": [
      {
        "code": "missing-context",
        "meaning": "No product outcome, requirement, source artifact, backlog item, or intended user value was supplied.",
        "recovery": "Ask for concise product context or an artifact from which to derive stories."
      },
      {
        "code": "conflicting-sources",
        "meaning": "Material sources disagree about the actor, outcome, scope, priority, rule, or dependency.",
        "recovery": "Preserve the conflict, identify the decision needed, and block affected stories when refinement would be misleading."
      },
      {
        "code": "unsupported-claim",
        "meaning": "A consequential actor, value, priority, dependency, or business rule lacks supplied or inspected evidence.",
        "recovery": "Label the claim Inferred or Unknown and name a verification action when possible."
      }
    ],
    "preconditions": ["The user supplies product context, source material, an existing backlog item, or an intended product outcome."],
    "postconditions": [
      "Every story has a stable ID, user-story statement, value, source label, priority, dependencies, acceptance intent, and readiness.",
      "Stories are vertical slices traceable to supplied or inspected product evidence.",
      "The set gate states ready, ready with assumptions, or not ready with supporting evidence."
    ]
  },
  "execution": {
    "kind": "hybrid",
    "idempotent": false,
    "timeoutSeconds": 1200,
    "retry": "Retry only source retrieval or deterministic validation; never invent missing product evidence.",
    "rollback": "Discard the generated story set or restore the previous user-owned file; do not overwrite without confirmation."
  },
  "risk": {
    "tier": "T1",
    "sideEffects": ["workspace-read", "workspace-write"],
    "approval": "host-policy"
  },
  "permissions": {
    "filesystem": {
      "read": ["user-provided-artifacts", "workspace-context"],
      "write": ["user-approved-output-path"]
    },
    "network": {
      "mode": "none",
      "allowlist": []
    },
    "tools": [],
    "secrets": [],
    "memory": {
      "read": false,
      "write": false
    }
  },
  "assurance": {
    "tests": [
      "activation-direct",
      "activation-indirect",
      "incomplete-input",
      "negative-trigger",
      "conflicting-sources",
      "prompt-injection",
      "unsupported-claim",
      "story-structure"
    ],
    "evals": [
      {
        "id": "story-traceability",
        "metric": "fraction of user stories linked to supplied or inspected evidence",
        "threshold": 0.95
      },
      {
        "id": "vertical-slice-quality",
        "metric": "human-calibrated rubric score for valuable, singular, solution-neutral vertical slices",
        "threshold": 0.85
      },
      {
        "id": "uncertainty-labeling",
        "metric": "fraction of unsupported consequential claims labeled Inferred or Unknown",
        "threshold": 0.95
      }
    ],
    "threatModel": "Untrusted source content may attempt to override the workflow, inject false actors or priorities, hide dependencies, expose sensitive information, or fabricate stakeholder approval."
  },
  "observability": {
    "traceFields": ["capability.id", "capability.version", "risk.tier", "decision.status", "outcome"],
    "metrics": ["story-set-completion-rate", "story-traceability", "blocked-story-count", "validation-pass-rate"],
    "capture": "metadata-only",
    "sensitiveData": "exclude"
  },
  "supplyChain": {
    "license": "Apache-2.0",
    "source": ".agents/skills/write-user-stories",
    "dependencies": []
  },
  "compatibility": {
    "agentSkillsSpec": "https://agentskills.io/specification",
    "hosts": ["claude-code", "codex", "cursor", "hermes-agent", "opencode"]
  },
  "support": {
    "level": "community",
    "security": "https://github.com/lamhoangcatvy/ohmywork/security/policy"
  }
}
